{
  "product_name": "Airrock HD",
  "extracted_text": "Műszaki adatlap\n\n\n Airrock HD\n Hő- és hangszigetelő lemez\n\n Gipszkarton válaszfalakba, zárt álmennyezetek fölé\n\n\n\nFel­hasz­ná­lá­s\nAz Airrock HD (HD = High Density, nagy testsűrűség) lemezek\nfelhasználása elsősorban a magasabb akusztikai követelményeket\nkielégítő szerelt gipszkarton válaszfalak akusztikai hang­szigetelő\nbetéteként ajánlott. Eredményesen alkalmazható zárt (nem per\n\n2019. február\n\n\n\nforált) álmennyezetek felső síkjára helyezve hang- és hőszigete­\nlésként. Javasolt a használata olyan szerkezetekben is, ahol\na kőzetgyapot közvetlenül áramló levegővel találkozik.\n\n\n Airrock HD\n\n Gipszkarton válaszfalakba, zárt álmennyezetek fölé\n\nA Rockwool kőzetgyapot tu­laj­don­sá­gai\nMűgyanta kötésű, teljes keresztmetszetében\nvíztaszító, csupasz kőzetgyapot lemez. Kiváló\nhőszigetelő. Nem éghető, hő hatására füstöt\nnem fejleszt, nincs égvecsepegése, képes a\ntűzterjedést megakadályozni. Nemcsak jól\nhangszigetel, hanem hangelnyelő képessége\nis kiemelkedő. Teljes keresztmetszetében\nvíztaszító, felületéről a vízcseppek leperegnek.\nPáraáteresztő képessége gyakorlatilag a levegőével megegyező. Nem zsugorodik, nincs\nhőmozgása. Az egészségre nem káros: magas\nbiológiai oldódóképességű, EUCEB minősítésű\nkőzetgyapot alapanyagból készül.\n\n\nCso­ma­go­lás\nAz Airrock HD lemezek Rockwool feliratos\npolietilén zsugorfóliába csomagolva, bálában\nkerülnek forgalomba. A ter­mék legfontosabb\ntulajdonságai a csomagolóanyagra ra­gasztott\nkísérőcímkén is olvashatók. A méretek, termékválaszték, csomagolási egységek az érvényes árlistában találhatók (www.rockwool.hu).\n\n\n\nÁltalános tudnivalók\n\nTermékeink előállítása az ISO 9001 és ISO\n14001 Integrált Minőség- és Környezetirányítási Rendszer keretein belül történik.\n\n\nA termékek és csomagoló anyagaik életciklus\nvégi kezelésével, ártalmatlanításával kapcsolatos további információk érdekében kérem,\nlátogassa meg honlapunkat. Termékeinkkel\nkapcsolatos további információért látogassa\nmeg honlapunkat: www.rockwool.hu\n\n\nA közölt műszaki információk a nyomtatás időpontjáig megszerzett legjobb szaktudásunkat\nés tapasztalatainkat tükrözik. Kérjük, győződjön meg arról, hogy ennek a prospektuslapnak\na legfrissebb változatát használja-e, mivel\nszaktudásunk és tapasztalatunk is folyamatosan gyarapodik.\n\n\n\nA ROCKWOOL\nkőzetgyapot erőssége\n\n\nA bazaltkő természetes erejével\nA bazaltkőben rejlő egyedülálló tulajdonságokat, unikális jellemzőket sikerült\nátmentenünk a ROCKWOOL kőzet­gyapottermékeibe. Egyedülállóan értékes és kiválóan hasznosítható megoldásokat kínálunk\nvevőinknek, melyeket az alábbi 7 érv is\nmegerősít.\n\n\nTűzvédelem\n\n\nEllenáll akár 1000°C-os hőmérsékletnek.\n\n\nHőszigetelés\n\n\nEnergiamegtakarítás és optimális belső hőmérséklet.\n\n\nHangszigetelés\n\n\nElnyeli a nemkívánatos külső zajokat.\n\n\nTartósság\n\n\nAlak- és mérettartó évtizedeken át.\n\n\nEsztétika\n\n\nEsztétikus homlokzatok és épületek.\n\n\nPáraáteresztés\n\n\nA kőzetgyapot kiváló páraáteresztő, alkalmazásával\nmegelőzhető a lakások penészesedése.\n\n\nÚjrahasznosítás\n\nÚjrafelhasználható anyag.\n\n\n\n\n\n\n\n\n\nTulajdonság: Jel\nTűzvédelmi osztály: —\nDeklarált hővezetési tényező: λD\nPáradiffúziós ellenállási tényező: m\nNévleges testsűrűség: ρsm\nVastagsági tűrés: T4\nVízfelvétel rövid ideig tartó<br>vízbe merítéskor: WS\nVízfelvétel hosszú ideig tartó<br>vízbe merítéskor: WL(P)\nÁramlási ellenállás: AF\nOlvadáspont: tt\nTermékjelölés: MW-EN-13162-T4-WS-WL(P)-AF5-MU1\nCE tanúsítvány száma: 1415-CPR-9-(C-7/2010)\n\n\nA termék Teljesítmény Nyilatkozata (DoP) elérhető: https://www.rockwool.hu/muszaki-informaciok/teljesitmeny-nyilatkozatok-dop/\n\n\n\nRockwool Hungary Kft.\nH-8300 Tapolca, Keszthelyi út 53.\nTel: +36 87/512-100\n\nVevőszolgálat: +36 87/512-103; -104; -105\n\nwww.ROCKWOOL.hu\n\n\n\nKeresse a ROCKWOOL-t az interneten is:\n\n\n[ROCKWOOL a YouTube-on](https://www.youtube.com/user/RockwoolHungary)\n\n\n[ROCKWOOL a Facebook-on](https://www.facebook.com/ROCKWOOL.hu)\n\n\n",
  "extracted_markdown": "Műszaki adatlap\n\n\n# Airrock HD\n### Hő- és hangszigetelő lemez\n\n#### Gipszkarton válaszfalakba, zárt álmennyezetek fölé\n\n\n\nFel­hasz­ná­lá­s\nAz Airrock HD (HD = High Density, nagy testsűrűség) lemezek\nfelhasználása elsősorban a magasabb akusztikai követelményeket\nkielégítő szerelt gipszkarton válaszfalak akusztikai hang­szigetelő\nbetéteként ajánlott. Eredményesen alkalmazható zárt (nem per\n\n2019. február\n\n\n\nforált) álmennyezetek felső síkjára helyezve hang- és hőszigete­\nlésként. Javasolt a használata olyan szerkezetekben is, ahol\na kőzetgyapot közvetlenül áramló levegővel találkozik.\n\n\n## Airrock HD\n\n#### Gipszkarton válaszfalakba, zárt álmennyezetek fölé\n\nA Rockwool kőzetgyapot tu­laj­don­sá­gai\nMűgyanta kötésű, teljes keresztmetszetében\nvíztaszító, csupasz kőzetgyapot lemez. Kiváló\nhőszigetelő. Nem éghető, hő hatására füstöt\nnem fejleszt, nincs égvecsepegése, képes a\ntűzterjedést megakadályozni. Nemcsak jól\nhangszigetel, hanem hangelnyelő képessége\nis kiemelkedő. Teljes keresztmetszetében\nvíztaszító, felületéről a vízcseppek leperegnek.\nPáraáteresztő képessége gyakorlatilag a levegőével megegyező. Nem zsugorodik, nincs\nhőmozgása. Az egészségre nem káros: magas\nbiológiai oldódóképességű, EUCEB minősítésű\nkőzetgyapot alapanyagból készül.\n\n\nCso­ma­go­lás\nAz Airrock HD lemezek Rockwool feliratos\npolietilén zsugorfóliába csomagolva, bálában\nkerülnek forgalomba. A ter­mék legfontosabb\ntulajdonságai a csomagolóanyagra ra­gasztott\nkísérőcímkén is olvashatók. A méretek, termékválaszték, csomagolási egységek az érvényes árlistában találhatók (www.rockwool.hu).\n\n\n\nÁltalános tudnivalók\n\nTermékeink előállítása az ISO 9001 és ISO\n14001 Integrált Minőség- és Környezetirányítási Rendszer keretein belül történik.\n\n\nA termékek és csomagoló anyagaik életciklus\nvégi kezelésével, ártalmatlanításával kapcsolatos további információk érdekében kérem,\nlátogassa meg honlapunkat. Termékeinkkel\nkapcsolatos további információért látogassa\nmeg honlapunkat: www.rockwool.hu\n\n\nA közölt műszaki információk a nyomtatás időpontjáig megszerzett legjobb szaktudásunkat\nés tapasztalatainkat tükrözik. Kérjük, győződjön meg arról, hogy ennek a prospektuslapnak\na legfrissebb változatát használja-e, mivel\nszaktudásunk és tapasztalatunk is folyamatosan gyarapodik.\n\n\n\nA ROCKWOOL\nkőzetgyapot erőssége\n\n\nA bazaltkő természetes erejével\nA bazaltkőben rejlő egyedülálló tulajdonságokat, unikális jellemzőket sikerült\nátmentenünk a ROCKWOOL kőzet­gyapottermékeibe. Egyedülállóan értékes és kiválóan hasznosítható megoldásokat kínálunk\nvevőinknek, melyeket az alábbi 7 érv is\nmegerősít.\n\n\nTűzvédelem\n\n\nEllenáll akár 1000°C-os hőmérsékletnek.\n\n\nHőszigetelés\n\n\nEnergiamegtakarítás és optimális belső hőmérséklet.\n\n\nHangszigetelés\n\n\nElnyeli a nemkívánatos külső zajokat.\n\n\nTartósság\n\n\nAlak- és mérettartó évtizedeken át.\n\n\nEsztétika\n\n\nEsztétikus homlokzatok és épületek.\n\n\nPáraáteresztés\n\n\nA kőzetgyapot kiváló páraáteresztő, alkalmazásával\nmegelőzhető a lakások penészesedése.\n\n\nÚjrahasznosítás\n\nÚjrafelhasználható anyag.\n\n\n\n\n\n\n\n\n\n|Tulajdonság|Jel|Érték|Mértékegység|Vonatkozó szabvány|\n|---|---|---|---|---|\n|Tűzvédelmi osztály|—|A1|—|EN 13501-1|\n|Deklarált hővezetési tényező|λD|0,035|W · m–1 · K–1|EN 12667, EN 12939|\n|Páradiffúziós ellenállási tényező|m|1|—|EN 13162|\n|Névleges testsűrűség|ρsm|70|kg · m–3|EN 1602|\n|Vastagsági tűrés|T4|-3% vagy -3 mm (a);<br>+5% vagy +5 mm (b)|A számszerűen nagyobb (a),<br>ill. kisebb (b) tűrést<br>eredményező a mértékadó.|EN 823|\n|Vízfelvétel rövid ideig tartó<br>vízbe merítéskor|WS|≤ 1,0|kg · m–2|EN 1609|\n|Vízfelvétel hosszú ideig tartó<br>vízbe merítéskor|WL(P)|≤ 3,0|kg · m–2|EN 12087|\n|Áramlási ellenállás|AF|5|kPa · s/m2|EN 13162|\n|Olvadáspont|tt|> 1000|°C|DIN 4102|\n|Termékjelölés|MW-EN-13162-T4-WS-WL(P)-AF5-MU1|MW-EN-13162-T4-WS-WL(P)-AF5-MU1|MW-EN-13162-T4-WS-WL(P)-AF5-MU1|EN 13162|\n|CE tanúsítvány száma|1415-CPR-9-(C-7/2010)|1415-CPR-9-(C-7/2010)|1415-CPR-9-(C-7/2010)|ÉMI Budapest|\n\n\nA termék Teljesítmény Nyilatkozata (DoP) elérhető: https://www.rockwool.hu/muszaki-informaciok/teljesitmeny-nyilatkozatok-dop/\n\n\n\nRockwool Hungary Kft.\nH-8300 Tapolca, Keszthelyi út 53.\nTel: +36 87/512-100\n\nVevőszolgálat: +36 87/512-103; -104; -105\n\nwww.ROCKWOOL.hu\n\n\n\nKeresse a ROCKWOOL-t az interneten is:\n\n\n[ROCKWOOL a YouTube-on](https://www.youtube.com/user/RockwoolHungary)\n\n\n[ROCKWOOL a Facebook-on](https://www.facebook.com/ROCKWOOL.hu)\n\n\n",
  "technical_specs": {
    "fire_classification": "A1",
    "thermal_conductivity": "0,035",
    "density": "70"
  },
  "pricing_info": {},
  "tables_data": [
    {
      "headers": [
        "Tulajdonság",
        "Jel",
        "Érték",
        "Mértékegység",
        "Vonatkozó szabvány"
      ],
      "data": [
        {
          "Tulajdonság": "Tűzvédelmi osztály",
          "Jel": "—",
          "Érték": "A1",
          "Mértékegység": "—",
          "Vonatkozó szabvány": "EN 13501-1"
        },
        {
          "Tulajdonság": "Deklarált hővezetési tényező",
          "Jel": "λD",
          "Érték": "0,035",
          "Mértékegység": "W · m–1 · K–1",
          "Vonatkozó szabvány": "EN 12667, EN 12939"
        },
        {
          "Tulajdonság": "Páradiffúziós ellenállási tényező",
          "Jel": "m",
          "Érték": "1",
          "Mértékegység": "—",
          "Vonatkozó szabvány": "EN 13162"
        },
        {
          "Tulajdonság": "Névleges testsűrűség",
          "Jel": "ρsm",
          "Érték": "70",
          "Mértékegység": "kg · m–3",
          "Vonatkozó szabvány": "EN 1602"
        },
        {
          "Tulajdonság": "Vastagsági tűrés",
          "Jel": "T4",
          "Érték": "-3% vagy -3 mm (a);<br>+5% vagy +5 mm (b)",
          "Mértékegység": "A számszerűen nagyobb (a),<br>ill. kisebb (b) tűrést<br>eredményező a mértékadó.",
          "Vonatkozó szabvány": "EN 823"
        },
        {
          "Tulajdonság": "Vízfelvétel rövid ideig tartó<br>vízbe merítéskor",
          "Jel": "WS",
          "Érték": "≤ 1,0",
          "Mértékegység": "kg · m–2",
          "Vonatkozó szabvány": "EN 1609"
        },
        {
          "Tulajdonság": "Vízfelvétel hosszú ideig tartó<br>vízbe merítéskor",
          "Jel": "WL(P)",
          "Érték": "≤ 3,0",
          "Mértékegység": "kg · m–2",
          "Vonatkozó szabvány": "EN 12087"
        },
        {
          "Tulajdonság": "Áramlási ellenállás",
          "Jel": "AF",
          "Érték": "5",
          "Mértékegység": "kPa · s/m2",
          "Vonatkozó szabvány": "EN 13162"
        },
        {
          "Tulajdonság": "Olvadáspont",
          "Jel": "tt",
          "Érték": "> 1000",
          "Mértékegység": "°C",
          "Vonatkozó szabvány": "DIN 4102"
        },
        {
          "Tulajdonság": "Termékjelölés",
          "Jel": "MW-EN-13162-T4-WS-WL(P)-AF5-MU1",
          "Érték": "MW-EN-13162-T4-WS-WL(P)-AF5-MU1",
          "Mértékegység": "MW-EN-13162-T4-WS-WL(P)-AF5-MU1",
          "Vonatkozó szabvány": "EN 13162"
        },
        {
          "Tulajdonság": "CE tanúsítvány száma",
          "Jel": "1415-CPR-9-(C-7/2010)",
          "Érték": "1415-CPR-9-(C-7/2010)",
          "Mértékegység": "1415-CPR-9-(C-7/2010)",
          "Vonatkozó szabvány": "ÉMI Budapest"
        }
      ],
      "row_count": 11,
      "col_count": 5
    }
  ],
  "markdown_tables": [
    "|Tulajdonság|Jel|Érték|Mértékegység|Vonatkozó szabvány|\n|---|---|---|---|---|\n|Tűzvédelmi osztály|—|A1|—|EN 13501-1|\n|Deklarált hővezetési tényező|λD|0,035|W · m–1 · K–1|EN 12667, EN 12939|\n|Páradiffúziós ellenállási tényező|m|1|—|EN 13162|\n|Névleges testsűrűség|ρsm|70|kg · m–3|EN 1602|\n|Vastagsági tűrés|T4|-3% vagy -3 mm (a);<br>+5% vagy +5 mm (b)|A számszerűen nagyobb (a),<br>ill. kisebb (b) tűrést<br>eredményező a mértékadó.|EN 823|\n|Vízfelvétel rövid ideig tartó<br>vízbe merítéskor|WS|≤ 1,0|kg · m–2|EN 1609|\n|Vízfelvétel hosszú ideig tartó<br>vízbe merítéskor|WL(P)|≤ 3,0|kg · m–2|EN 12087|\n|Áramlási ellenállás|AF|5|kPa · s/m2|EN 13162|\n|Olvadáspont|tt|> 1000|°C|DIN 4102|\n|Termékjelölés|MW-EN-13162-T4-WS-WL(P)-AF5-MU1|MW-EN-13162-T4-WS-WL(P)-AF5-MU1|MW-EN-13162-T4-WS-WL(P)-AF5-MU1|EN 13162|\n|CE tanúsítvány száma|1415-CPR-9-(C-7/2010)|1415-CPR-9-(C-7/2010)|1415-CPR-9-(C-7/2010)|ÉMI Budapest|"
  ],
  "confidence_score": 0.668,
  "extraction_method": "pymupdf4llm-lines",
  "source_filename": "Airrock HD termékadatlap.pdf",
  "processing_time": 1.501995
}